Series,Volume,Start,End,Pages,Title,Month,Year,Arc,Rank
Ralph Azham,01,1,46,46,Est-ce qu'on ment aux gens qu'on aime ?,03,2011,Premier cycle,1
Ralph Azham,02,47,92,46,La mort au début du chemin,08,2011,Premier cycle,2
Ralph Azham,03,93,142,50,Noires sont les étoiles,04,2012,Premier cycle,3
Ralph Azham,04,143,192,50,Un caillou enterré n'apprend jamais rien,10,2012,Deuxième cycle,4
Ralph Azham,05,193,238,46,Le pays des démons bleus,05,2013,Deuxième cycle,5
Ralph Azham,06,239,284,46,L'ennemi de mon ennemi,02,2014,Deuxième cycle,6
Ralph Azham,07,285,330,46,Une fin à toute chose,11,2014,Deuxième cycle,7
Ralph Azham,08,331,376,46,Personne n'attrape une rivière,10,2015,Troisième cycle,8
Ralph Azham,09,377,422,46,Point de rupture,09,2016,Troisième cycle,9
Ralph Azham,10,423,468,46,Un feu qui meurt,06,2017,Troisième cycle,10
Ralph Azham,11,469,514,46,L'engrenage,04,2018,Troisième cycle,11
Ralph Azham,12,515,558,44,Lâcher prise,08,2019,Troisième cycle,12
